{
  "schema_version": "0.1",
  "target": {
    "interface": "mcp",
    "name": "ticketq"
  },
  "capabilities": [
    {
      "id": "cap-find-tickets",
      "operation": "find_tickets",
      "binding": {
        "tool": "query_tickets",
        "fixed_args": { "action": "find_tickets" }
      },
      "params": [
        { "name": "action", "type": "string", "required": true },
        { "name": "queue", "type": "string", "required": false },
        { "name": "status", "type": "string", "required": false }
      ],
      "outcome_classes": [
        {
          "id": "oc-find-tickets-success",
          "kind": "success",
          "description": "Returns a list of tickets matching the queue and status filters (clm-api-json-007, clm-notes-md-008)."
        },
        {
          "id": "oc-find-tickets-empty",
          "kind": "underspecified",
          "description": "No claim describes what is returned when no ticket matches the queue/status filters (see gap-find-tickets-empty)."
        },
        {
          "id": "oc-find-tickets-not-found",
          "kind": "underspecified",
          "description": "Not applicable as a distinct case in the claims: find_tickets is a list search, not a lookup by identifier, and no claim addresses a not-found case for it."
        },
        {
          "id": "oc-find-tickets-error",
          "kind": "underspecified",
          "description": "No claim describes what happens when queue, status, or action is given a value outside its enumerated set (see gap-invalid-enum-values)."
        },
        {
          "id": "oc-find-tickets-missing-action",
          "kind": "underspecified",
          "description": "No claim describes what happens when the required action field is omitted entirely (see gap-missing-action-field)."
        }
      ],
      "claims": [
        "clm-api-json-001", "clm-api-json-002", "clm-api-json-003",
        "clm-api-json-004", "clm-api-json-005", "clm-api-json-007",
        "clm-notes-md-003", "clm-notes-md-008"
      ],
      "confidence": "high"
    },
    {
      "id": "cap-get-ticket",
      "operation": "get_ticket",
      "binding": {
        "tool": "query_tickets",
        "fixed_args": { "action": "get_ticket" }
      },
      "params": [
        { "name": "action", "type": "string", "required": true },
        { "name": "ticket_id", "type": "integer", "required": true }
      ],
      "outcome_classes": [
        {
          "id": "oc-get-ticket-success",
          "kind": "success",
          "description": "Returns one ticket with its comments, ordered by comment position (clm-api-json-008, clm-notes-md-009)."
        },
        {
          "id": "oc-get-ticket-empty",
          "kind": "underspecified",
          "description": "Not applicable as stated: get_ticket returns a single ticket, not a collection that can be legitimately empty; whether the comments list can be empty is separately unaddressed (see gap-get-ticket-zero-comments)."
        },
        {
          "id": "oc-get-ticket-not-found",
          "kind": "underspecified",
          "description": "No claim describes what get_ticket returns when given a ticket_id that does not exist (see gap-get-ticket-not-found)."
        },
        {
          "id": "oc-get-ticket-error",
          "kind": "underspecified",
          "description": "No claim describes what happens when the required action field is omitted, or when ticket_id is missing or malformed (see gap-missing-action-field)."
        },
        {
          "id": "oc-get-ticket-zero-comments",
          "kind": "underspecified",
          "description": "No claim states whether comments are returned as an empty list or omitted when a ticket exists but has zero comments (see gap-get-ticket-zero-comments)."
        }
      ],
      "claims": [
        "clm-api-json-001", "clm-api-json-002", "clm-api-json-003",
        "clm-api-json-006", "clm-api-json-008",
        "clm-notes-md-004", "clm-notes-md-009", "clm-notes-md-010"
      ],
      "confidence": "high"
    }
  ],
  "entities": [
    {
      "id": "ent-ticket",
      "name": "Ticket",
      "collection": "tickets",
      "fields": [
        { "name": "ticket_id", "type": "integer" },
        { "name": "queue", "type": "string" },
        { "name": "status", "type": "string" },
        { "name": "summary", "type": "string" },
        { "name": "comment_count", "type": "integer" }
      ],
      "relations": [
        { "name": "comments", "target_entity_id": "ent-comment", "cardinality": "many" }
      ],
      "invariants": [
        {
          "id": "inv-comment-count",
          "statement": "comment_count on a ticket equals the number of comment records attached to it; a stored value that disagrees is overwritten on read (clm-notes-md-005, clm-notes-md-006).",
          "machine": {
            "form": "count",
            "collection": "tickets",
            "field": "comment_count",
            "of": "comments",
            "local_key": "ticket_id",
            "foreign_key": "ticket_id"
          }
        },
        {
          "id": "inv-ticket-id-unique",
          "statement": "ticket_id is unique across every queue (clm-notes-md-007).",
          "machine": {
            "form": "unique",
            "collection": "tickets",
            "field": "ticket_id"
          }
        },
        {
          "id": "inv-queue-values",
          "statement": "queue is restricted to billing or shipping: api.json enumerates exactly these two values and notes.md independently states ticketq fronts two queues, billing and shipping (clm-api-json-004, clm-notes-md-001).",
          "prose": "queue takes only the values billing and shipping."
        }
      ],
      "claims": [
        "clm-api-json-009", "clm-api-json-004", "clm-notes-md-001",
        "clm-notes-md-005", "clm-notes-md-006", "clm-notes-md-007"
      ]
    },
    {
      "id": "ent-comment",
      "name": "Comment",
      "collection": "comments",
      "fields": [
        { "name": "comment_id", "type": "integer" },
        { "name": "ticket_id", "type": "integer" },
        { "name": "position", "type": "integer" },
        { "name": "body", "type": "string" }
      ],
      "invariants": [
        {
          "id": "inv-comment-blocker-in-body",
          "statement": "Inferred from notes.md, not stated by any schema field: a ticket's blocker is named somewhere within the text of its comments, but no field structurally marks which comment or what text names it (clm-notes-md-010).",
          "prose": "body may name the ticket's blocker as free text; no structured field marks this."
        }
      ],
      "claims": ["clm-api-json-010", "clm-notes-md-010"]
    }
  ],
  "actors": [
    {
      "id": "actor-support-engineer",
      "name": "support engineer",
      "claims": ["clm-notes-md-002"]
    }
  ],
  "goals": [
    {
      "id": "goal-find-ticket-to-act-on",
      "actor_id": "actor-support-engineer",
      "statement": "Find the ticket in a given queue that still needs the engineer to act on it.",
      "expected_hop_depths": [1],
      "claims": ["clm-notes-md-003", "clm-notes-md-008"]
    },
    {
      "id": "goal-explain-why-stuck",
      "actor_id": "actor-support-engineer",
      "statement": "Explain why a ticket is stuck by finding the ticket, then reading its comments for the named blocker.",
      "expected_hop_depths": [2],
      "claims": ["clm-notes-md-004", "clm-notes-md-009", "clm-notes-md-010"]
    }
  ],
  "contradictions": [],
  "gaps": [
    {
      "id": "gap-missing-action-field",
      "subject": "query_tickets with a missing or invalid action value",
      "unknown": "What query_tickets returns or raises when action is omitted (though required, per clm-api-json-002) or given a value other than find_tickets/get_ticket.",
      "why_it_matters": "Neither input artifact describes any error behaviour for query_tickets; a scenario testing the required field or the two-value enum has no stated ground truth to assert against.",
      "blocks": ["propose", "score", "instantiate", "challenge", "emit", "smoke"]
    },
    {
      "id": "gap-find-tickets-empty",
      "subject": "find_tickets with no matching tickets",
      "unknown": "What find_tickets returns when no ticket matches the queue/status filters given.",
      "why_it_matters": "No claim states the empty-result shape (empty list vs. an error vs. something else), so a scenario built on the empty outcome class has no stated ground truth.",
      "blocks": ["propose", "score", "instantiate", "challenge", "emit", "smoke"]
    },
    {
      "id": "gap-get-ticket-not-found",
      "subject": "get_ticket with a ticket_id no ticket has",
      "unknown": "What get_ticket returns or raises for an unknown ticket_id. No claim in this claim set addresses it, and unlike the api.json/notes.md/trace.json fixture, this run has no third artifact corroborating either an error or an empty-object behaviour -- there is nothing here to resolve, only silence.",
      "why_it_matters": "Both goals recorded here route through get_ticket; without a stated not-found behaviour neither goal's error path can be scored or instantiated soundly.",
      "blocks": ["propose", "score", "instantiate", "challenge", "emit", "smoke"]
    },
    {
      "id": "gap-invalid-enum-values",
      "subject": "queue and status given values outside their enumerated sets",
      "unknown": "Whether query_tickets errors, ignores the filter, or does something else when queue or status is given a value other than the ones api.json enumerates.",
      "why_it_matters": "This is a bad-argument path a real client can trigger, and no claim states its behaviour.",
      "blocks": ["propose", "score", "instantiate", "challenge", "emit", "smoke"]
    },
    {
      "id": "gap-get-ticket-zero-comments",
      "subject": "get_ticket on a ticket whose comment_count is 0",